text,label
Where were the 1936 Summer Olympics held ?,LOC
What is a fear of rejection ?,ENTY
How many equal angles are there in an isosceles triangle ?,NUM
How long was Mao 's 1930s Long March ?,NUM
Where was the largest concentration camp in World War II ?,LOC
How do you get dates with the `` Hooters '' girls ?,DESC
What mountain range extends from the Gulf of St. Lawrence to Alabama ?,LOC
Where is the massive North Korean nuclear complex located ?,LOC
What were the names of the three ships used by Columbus ?,ENTY
How big is the universe actually ?,NUM
What is the text of the Fifth Amendment ?,DESC
What college football team did Knute Rockne build into a power ?,HUM
Who is Snoopy 's arch-enemy ?,HUM
Name a French fascist party .,HUM
What does the theory of quantum leaps mean in simpler terms ?,DESC
Where did the Inuits live ?,LOC
What 's the favorite food of dragonflies ?,ENTY
What does the word `` meta '' mean ?,DESC
What is Zionism ?,DESC
Who wrote The Secret Life of Walter Mitty ?,HUM
What two countries fought the Hundred Years ' War ?,LOC
When was Dubai 's first concrete house built ?,NUM
What nationality were the 123 people who died in the Black Hole of Calcutta ?,LOC
What is it like to experience a near death episode ?,DESC
What is the brand name of daminozide ?,ENTY
Where did the myth of Santa Claus originate ?,LOC
Who is the superstar in rent-a-cars ?,HUM
Who was the author of the book about computer hackers called `` The Cuckoo 's Egg : Tracking a Spy Through the Maze of Computer Espionage '' ?,HUM
What city in Florida is Sea World in ?,LOC
Name the organization that is presided by a Security Council .,HUM
Which ear can most people hear better with ?,ENTY
What state in the United States covers the largest area ?,LOC
Whose autobiography is titled Yes I Can ?,HUM
What is the weakest bone in the body ?,ENTY
Name the Ranger who was always after Yogi Bear .,HUM
What is the difference between optical and digital video ?,DESC
In what movie is the number nine found in the title ?,ENTY
What is the origin of the word `` mushroom '' ?,DESC
Where can I find info on research being done on oilseeds thru genetics ?,LOC
What is the hair style called that new military recruits receive ?,DESC
In what year was the first patent for the pull-tab opener on cans obtained ?,NUM
What kind of business is 7-Eleven ?,HUM
Where 's the Petrified Forest ?,LOC
What does `` saute '' mean ?,DESC
What Apollo 11 astronaut minded the store while Armstrong and Aldrin made history ?,HUM
Who sings the song `` Drink to me with thine eyes '' by Ben Johnson ?,HUM
How many Community Chest cards are there in Monopoly ?,NUM
How many people did Randy Craft kill ?,NUM
Where is the Abominable Snowman said to wander ?,LOC
How many colleges are in Wyoming ?,NUM
What was William F. Cody 's better-known name ?,HUM
What is a fear of money ?,ENTY
Who did Napolean defeat at Jena and Auerstadt ?,HUM
What canal does the Thatcher Ferry Bridge span ?,LOC
What meter was invented by C.C. Magee in 1935 ?,ENTY
What D.H. Lawrence novel was originally titled Tenderness ?,ENTY
How does marijuana lead to other drugs ?,DESC
Who was the first coach of the Cleveland Browns ?,HUM
What is a common anti-AIDS drug ?,ENTY
What English word contains the most letters ?,ENTY
What is the history of Valentine 's Day cards ?,DESC
Where did the ukulele originate ?,LOC
"Who was shot in the back during a Poker game in Deadwood , the Dakota territory ?",HUM
What year did Apartheid start ?,NUM
What woman was Time 's Man of the Year for 1952 ?,HUM
What enigmatic U.S. vice president was once tried and acquitted for treason in a plot to set up his own independent empire in the West ?,HUM
What is a leaky heart valve ?,DESC
What was the name of the computer in ` 2001 : A Space Odyssey ' ?,ENTY
What did Esquire name Ash Hole of the Year for 1980 ?,ENTY
"Which is the largest clock , diameter wise , in Europe ?",ENTY
What is the largest U.S. state east of the Mississippi ?,LOC
Where is your corpus callosum ?,LOC
How does light travel through the void of space if there is no medium for it to ` wave ' or ` pulse ' .,DESC
Where is Tornado Alley ?,LOC
How fast can a Corvette go ?,NUM
What is the use of a 24-hour clock instead of a 12-hour clock ?,DESC
Where does chocolate come from ?,LOC
What rabbit got its name because its ears resembled those of a jackass ?,ENTY
What diamond producer controls about 80% of the world 's diamonds ?,HUM
Who was the prophet of the Jewish people ?,HUM
Who was the first Russian astronaut to walk in space ?,HUM
What South American city has the world 's highest commercial landing field ?,LOC
How can you contact play producers and promoters on-line ?,DESC
What fast-food magnate 's initials graced the left sleeve of the San Diego Padres ' baseball uniforms in 1984 ?,HUM
Who followed Caesar ?,HUM
What British TV series featured Emma Peel ?,ENTY
What is the name of the firm that makes Spumante ?,HUM
"What are vermicilli , rigati , zitoni , and tubetti ?",DESC
"Who provides telephone service in Orange County , California ?",HUM
How fast is light ?,NUM
What facial feature did Walt Disney sport that none of Disney 's employees is allowed to ?,DESC
What motto ended Merrie Melodies cartoons ?,DESC
What TV series features the adventures of a married couple named Jonathan and Jennifer ?,ENTY
"Why do some jets have a vapor trail , and others do not ?",DESC
How can I find a list of celebrities ' real names ?,DESC
Where can I find the lyrics for the song ` Getting Married Today ' from the musical ` Company ' ?,LOC
What are Arnold Palmer 's fans called ?,HUM
How many sides does an obelisk have ?,NUM
What U.S. senator once played basketball for the New York Knicks ?,HUM
How do I do this ?,DESC
Where is Mile High Stadium ?,LOC
What is the name of the 1919 occurrence in which British troops killed over 3 unarmed Indian protestors ?,ENTY
What does gringo mean ?,DESC
How many of every 10 members of the Rodeo Cowboys Association have never worked a ranch ?,NUM
Name the food company that traveled to Soviet Georgia to film a series of ads .,HUM
What is IOC an abbreviation of ?,ABBR
How many wives did Brigham Young have ?,NUM
What continent is Bolivia on ?,LOC
What city is wiener schnitzel named for ?,LOC
What National Basketball Association superstar told his story in Giant Steps ?,HUM
How did people respond to the idea of the first millenium ?,DESC
What is the population in India ?,NUM
Who is the actress Bette Davis once said she wished she looked like ?,HUM
Who invented basketball ?,HUM
What time of year has the most air travel ?,NUM
What is the name of the company that manufactures the `` American Girl '' doll collection ?,HUM
Name a Salt Lake City newspaper .,ENTY
Who is the Voyager project manager ?,HUM
What is the best distance education university or college ?,HUM
What does LOL mean ?,ABBR
When was Ozzy Osbourne born ?,NUM
Why do pressure cookers save time in the kitchen ?,DESC
What does Tiffany mean ?,DESC
What chocolate company gives you a one-pound kiss ?,HUM
What is the Golden Rule ?,DESC
What country was the setting of You Only Live Twice ?,LOC
How long does cocaine stay in your system ?,NUM
How many times in his 16-year National Basketball Associaton career was John Havlicek a member of the all-star team ?,NUM
What is state tree of Nebraska ?,ENTY
What is the fastest commercial automobile that can be bought in the US ?,ENTY
How can I search for a word within my own webpage ?,DESC
"What cereal goes `` snap , crackle , pop '' ?",ENTY
What did Aaron Hass write ?,ENTY
The Olympic Games in which year allowed Nadia Comaneci to become popular ?,NUM
Why are the ears your center of balance ?,DESC
Who was Whitcomb Judson ?,HUM
What 's the second-biggest-selling magazine in America ?,ENTY
"What group was formed in 1969 after police met resistance from patrons at the Stonewall , a Greenwich Village gay bar ?",HUM
What do you call a `` twirl '' in ballet ?,ENTY
How much is a Canadian 1967 twenty dollar gold coin worth ?,NUM
What did Martin Luther post on the church door at Wittenberg ?,ENTY
What is a fear of thunder ?,ENTY
What is Grenada 's main commodity export ?,ENTY
"What do the names Neil , Mary , and Anthony mean ?",DESC
What 's a perfect score in a gymnastics exercise ?,NUM
How much money was the minimum wage in 1991 ?,NUM
What series of trials followed World War II ?,ENTY
Who is the nebbish that is Marvel 's official mascot ?,HUM
What famous comedian recently tried without success to revive the play ?,HUM
What is barnstorming ?,DESC
Which of the following actors worked in New York 's Yiddish Theater ?,HUM
What is the Homelite Inc. home page ?,LOC
What was the former residence of Scottish kings in Edinburgh ?,LOC
What is the purpose of BIOS ?,DESC
What country in Latin America is the largest one ?,LOC
What 's a male `` cuckquean '' ?,DESC
What is the contents of proposition 98 ?,DESC
What makes salt ?,DESC
Who is Colin Powell ?,HUM
Who are the top 10 richest people in the world ?,HUM
What is a fear of passing high objects ?,ENTY
What is a fear of fur ?,ENTY
"Where was the Cisalpine Republic , 1797-185 , ?",LOC
How many people died on D-Day ?,NUM
"What TV comedian worked with White Fang , Black Tooth and Pookie the Lion ?",HUM
Which major diamond producer is based in South Africa ?,HUM
What season is the setting for Shakespeare 's Midsummer Night 's Dream ?,NUM
What year did Jack Nicklaus join the Professional Golfers Association tour ?,NUM
How many calories are there in a glass of water ?,NUM
Who were the head writers for the Smothers Brothers Comedy Hour ?,HUM
What high school does Archie attend ?,HUM
What can one see in Reims ?,ENTY
What are the three most successful companies of our time ?,HUM
How big is the largest diamond ?,NUM
"What President lived at 219 North Delaware Street , Independence , Missouri ?",HUM
What name does the world know Renaissance artist Kyriakos Theotokopoulos by ?,HUM
What is the main ingredient of yogurt ?,ENTY
"What was the nickname of Frederick I , Holy Roman Emperor and King of Germany ?",HUM
Where are the 49 steps ?,LOC
What is the virus HIV ?,DESC
What New England state covers 5.9 square miles ?,LOC
What suburban housewife and mother of three wrote The Feminine Mystique ?,HUM
Who painted Mother and Child ?,HUM
What was Paul Bunyan 's ox 's name ?,ENTY
How long do flies live ?,NUM
Aspartame is known by what other name ?,ENTY
What does Warner Bros. call a flightless cuckoo ?,ENTY
What state did Helen Keller call home ?,LOC
Where is the Valley of the Kings ?,LOC
What information can you get me on Fairground Park in St. Louis,DESC
Which side of the face do most artists tend to show more of in self-portraits ?,ENTY
What Hollywood dog died in the arms of Jean Harlow in 1932 ?,ENTY
Which breakfast cereal brought you `` the best each morning '' ?,ENTY
What company is being bought by Yahoo and how much is the deal worth ?,HUM
How was the element calcium named ?,DESC
What credit card features a centurion on its face ?,ENTY
Which country is Australia 's largest export market ?,LOC
How many pins are used in skittles ?,NUM
"What is a term for behavior , appearance , or expression that violates the accepted standards of sexual morality ?",ENTY
What is the population of Mexico ?,NUM
What comedian was born Allen Stewart Konigsberg ?,HUM
What does the River Seine empty into ?,LOC
What exactly is the purpose of the anteater ?,DESC
"What was the non-fiction best-seller of 1952 , 1953 and 1954 ?",ENTY
What year did Montana become a state ?,NUM
What is Colin Powell best known for ?,DESC
What are the Nordic nations ?,LOC
What 's the abbreviation for trinitrotoluene ?,ABBR
What relative of the racoon is sometimes known as the cat-bear ?,ENTY
Name the creator of `` The Muppets '' .,HUM
Why is Jane Goodall famous ?,DESC
What 's the claim to fame of night watchman Frank Wills ?,DESC
Which college did Dikembe Mutombo attend ?,HUM
Where can I find correct tabs for Third Eye Blind songs ?,LOC
What 's an auberge in France ?,DESC
What are close encounters of the first and second kind ?,ENTY
What can I do to get into an Ivy League school ?,DESC
What is the rarest coin ?,ENTY
"What were Baffin , Frobisher and Franklin looking for ?",ENTY
"What are Kythnos , Siphnos , Seriphos and Mykonos ?",DESC
When was the USSR dissolved ?,NUM
What 1976 Deep Throat clone provides the leading lady with a second larynx ?,ENTY
What ever happened to the once popular Yale Lock Company ?,DESC
Where do I find information for foreclosure properties on the Internet ?,LOC
What are the wolverine habits ?,ENTY
How long ago was the Roe vs. Wade decision by the Supreme Court ?,NUM
What company named one of its pens `` The Banana '' ?,HUM
What 's the hardest substance in the human body ?,ENTY
Where can I get mailing lists ?,LOC
"How many miles are there between Tel Aviv , Israel and Memphis , Tennessee ?",NUM
What does the Latin ante mortem mean ?,DESC
What does `` E Pluribus Unum '' on the penny mean ?,DESC
What kind of substance is dextropropoxyphen napsylate ?,ENTY
What does God create in the first sentence of the Bible ?,ENTY
Who is Rocky 's and Bullwinkle 's ever-lost friend ?,HUM
What is the history of the hairdryer ?,DESC
What month 's third weekend is the Monterey Jazz Festival held on ?,NUM
What is a softball made of ?,ENTY
In what year was the Berlin Wall erected ?,NUM
Who said `` What contemptible scoundrel stole the cork from my lunch ? '',HUM
How tall is Prince Charles ?,NUM
How many logarithmic scales are there on a slide rule ?,NUM
How many members of a family could be drafted in the U.S. military during World War II ?,NUM
What volcano showers ash on Sicily ?,LOC
What was another name for East Germany ?,ENTY
What famous events have happened on March 27 ?,ENTY
How do I install a tile floor ?,DESC
Who was Ezra Taft Benson ?,HUM
How do I impress a guy ?,DESC
What does Elysium mean ?,DESC
How did names come about ?,DESC
What is the term that describes a word where only one usage has been recorded in all literature ?,ENTY
Italy is the largest producer of what ?,ENTY
When was the Triangle Shirtwaist fire ?,NUM
What are binomial coefficients ?,DESC
"Whose husbands have included Conrad Hilton Jr. , and Michael Wilding ?",HUM
How much did Lucy Van Pelt originally charge for psychiatric sessions ?,NUM
What was the `` Dead Man 's Hand '' ?,DESC
What instrument is Ray Charles best known for playing ?,ENTY
What was Thatcher 's approval rating after 10 years in power ?,NUM
What is a fear of failure ?,ENTY
What was the occupation of Mandy Rice-Davies ?,HUM
What is `` Nine Inch Nails '' ?,DESC
Who 's the only president buried in Washington,HUM
A corgi is a kind of what ?,ENTY
Which country is the largest country in Latin America ?,LOC
How many cables support the main span of the Golden Gate Bridge ?,NUM
What does the Georgetown `` Hoya '' mean ?,DESC
What is Smartnet ?,DESC
How many disks does each player have in a four-handed game of Crokinole ?,NUM
Who invented the stethoscope ?,HUM
"How many times has `` Louie , Louie '' been recorded ?",NUM
What 's bottled in jeroboams ?,ENTY
How many people died when the Estonia sank in 1994 ?,NUM
What are amaretto biscuits ?,DESC
What country is the worlds leading supplier of cannabis ?,LOC
What 's the largest letter in Salvador Dali 's signature ?,ENTY
Who killed Martin Luther King ?,HUM
What kind of fruit is a Yellow Transparent ?,ENTY
"What kind of animals are Dorsets , Lincolns , Oxfords and Southdowns ?",ENTY
How long is the border between Canada and the 48 conterminous states ?,NUM
Who portrayed `` Rosanne Rosanna-Dana '' on the television show `` Saturday Night Live '' ?,HUM
Which presidents of the USA were Masons ?,HUM
What little boy and dog live in a shoe ?,HUM
What do sailors use to measure time ?,ENTY
What are bear and bull markets ?,DESC
Who won the rugby world cup in ?,HUM
What is the occupation of Nicholas Cage ?,HUM
Where was Richard Nixon when Gerald Ford became president ?,LOC
What is HDLC ?,ABBR
Who is the leader of India ?,HUM
Musician Ray Charles plays what instrument ?,ENTY
What two major world religions began in India ?,ENTY
How many years did it take James Joyce to write Ulysses ?,NUM
What are the various ways in which one can measure IT User Satisfaction Level ?,ENTY
What does Nicholas Cage do for a living ?,HUM
Where does the song Anything Goes take place ?,LOC
How were the days of the week named ?,DESC
What species is a colt ?,ENTY
How many colored squares are there on a Rubik 's Cube ?,NUM
"What President 's favorite Biblical quotation was : `` Come now , and let us reason together '' .",HUM
How do you reference a website ?,DESC
"What did 8 , CD NNS VBP TO VB NNP POS NN .",ENTY
What is the only modern language that capitalizes its singular first-person pronoun ?,ENTY
"What children 's tale contains the line : `` Come , Cinderslut , and hold this skein of wool for me '' ?",ENTY
What does Freddy Freeman say to become Captain Marvel Jr. ?,DESC
How do I tie a tie ?,DESC
Who played Al Jolson in the Jolson Story ?,HUM
What is Jane Goodall known for ?,DESC
What was the tragedy that struck the city of Dogtown in 1899 ?,ENTY
How many letters appear with the numbers 2 to 9 on a telephone dial ?,NUM
How big is Australia ?,NUM
What happened to Pompeii ?,DESC
Who was Darth Vader 's son ?,HUM
What is a storm surge ?,DESC
What do camels store in their humps ?,ENTY
Who is the current prime minister and president of Russia ?,HUM
In what year did they build the Berlin Wall ?,NUM
What does A&W of root beer fame stand for ?,ABBR
What is Shirley MacLaine known as ?,ENTY
Which of the following famous people does not paint as a hobby ?,HUM
What do you call a section of your finger from one joint to another ?,ENTY
About how many Americans are still unaccounted for from the Vietnam war ?,NUM
How many James Bond novels are there ?,NUM
What knighted actor narrates TV 's The World at War ?,HUM
How many inches over six feet is the Venus de Milo ?,NUM
What is ouzo ?,DESC
What was the name of Randy Steven Craft 's lawyer ?,HUM
What 's new in the postal world in 1999 ?,DESC
What is Head Start ?,DESC
What does Salk vaccine prevent ?,ENTY
What disease is the second-biggest killer of North Americans ?,ENTY
What are the top ten most common girl names in the US ?,HUM
What does IBM stand for ?,ABBR
How many endangered species are there in the world ?,NUM
How many people died in the Vietnam war ?,NUM
What are the different approaches of systems analysis ?,ENTY
What does the number 33 on the Rolling Rock beer bottle mean ?,DESC
What color is the cross on Switzerland 's flag ?,ENTY
Who founded the People 's Temple Commune ?,HUM
What country has been called The Queen of the Antilles ?,LOC
What organization has a Security Council ?,HUM
"What is the US Federal Government website for Standard Industrial Classification codes , SIC , ?",LOC
How many different kinds of ice cream are there ?,NUM
Where can I find info on Alexander Mackenzie ?,LOC
Who is the Queen of Holland ?,HUM
What James Michener book is subtitled Spanish Travels and Reflections ?,ENTY
What was the first country to put a second woman in space ?,LOC
What is thalassemia ?,DESC
How do you do a topic outline ?,DESC
What is the origin of the word trigonometry ?,DESC
How many innings constitute an official baseball game ?,NUM
How many hours of work does it take a typist to complete a 100-page screenplay ?,NUM
What 's the most delicate-tasting member of the onion family ?,ENTY
What is a `` False Moon '' ?,DESC
What is the origin of the expression `` four-letter word '' ?,DESC
What U.S. state ends with a G ?,LOC
What is the size of the largest akita ?,NUM
"Name the company that used the line , `` Even your best friend won 't tell you '' in its ad ?",HUM
Name a South African diamond producer ?,HUM
How many hands does Bjorn Borg use when hitting his forehand ?,NUM
What is a neurosurgeon ?,DESC
Where do chihuahuas come from ?,DESC
What type of currency is used in China ?,ENTY
What facial feature typically contains about 55 hairs ?,DESC
What is the present Pope named ?,HUM
What 's the origin of the word ` news ' ?,DESC
How do I change a file from an ART file to a JPEG or Bitmap file ?,DESC
What is the brightest star visible from Earth ?,LOC
"What kind of puzzle first appeared in the U.S. in the New York World on December 21 , 1913 ?",ENTY
What is Occam 's Razor ?,DESC
How is water treated to make it safe to drink ?,DESC
What is the life span of the average monkey ?,NUM
What character did Tex Avery first create upon arriving at MGM ?,HUM
What is the origin of the term `` buffalo wings '' that is used as a menu item in bars across the nation for chicken wings in a spicey sauce ?,DESC
What was the orca 's name that died of a fungal infection at Sea World ?,ENTY
What were Babe Ruth 's Christian names ?,HUM
Aspartame is also called what ?,ENTY
Who was the first President to appoint a woman to head a cabinet ?,HUM
What 's the most extensively grown and eaten food ?,ENTY
How many degrees cooler is the inside of a cucumber than the air outside ?,NUM
"Who portrayed Fatman in the television show , `` Jake and the Fatman '' ?",HUM
"Which is a real berry : blackberry , cranberry , raspberry , strawberry ?",ENTY
What does `` B.Y.O.B. '' mean ?,ABBR
What occupation has the highest divorce rate ?,HUM
What oldtime kids ' fare did TV Guide writer Jeff Greenfield call `` one of the most...subversive TV shows in American history '' ?,ENTY
What is viscosity ?,DESC
What is the `` fourth dimension '' ?,DESC
What university was Woodrow Wilson President of ?,HUM
What is the current ticket fare from from Cairo to Barbados ?,NUM
"What do the letters D.C. stand for in Washington , D.C. ?",ABBR
What is a `` node '' in computer terms ?,DESC
Who sells Viagra ?,HUM
Who is Olive Oyl 's brother ?,HUM
Why do people shake hands to show friendliness ?,DESC
Ray Charles plays which instrument ?,ENTY
What is a fear of fish ?,ENTY
What 's the main vegetable in vichyssoise ?,ENTY
What is the world 's deadliest infectious disease ?,ENTY
Who was the first black golfer to tee off in the Masters ?,HUM
How does hair curl ?,DESC
How many Canadians emmigrate each year ?,NUM
What made the short-lived Star Hawks strip so unique ?,DESC
What is after death ?,ENTY
What do goldfish lose if kept in dimly-lit or running water ?,ENTY
Which king signed the Magna Carta ?,HUM
How many chemical elements are there ?,NUM
What female painter produced primitives of rural New England life ?,HUM
What was Eduard Shevardnadze 's job in the Soviet Union ?,HUM
What do you call a Poker hand with five cards of the same suit ?,ENTY
What Judith Rossner novel was made into a film starring Diane Keaton ?,ENTY
"What Las Vegas hotel burned in November , 1980 , with the loss of 84 lives ?",LOC
What Chilean president was killed in a 1973 coup d 'etat ?,HUM
How many fiddlers did Old King Cole have ?,NUM
What is `` the computer for the rest of us '' ?,DESC
What time of year is air travel the heaviest ?,NUM
"What inescapable purveyor of background music celebrated its 5th anniversary in July , 1984 ?",HUM
Who is currently the most popular singer in the world ?,HUM
Which cats pursued Tweety Pie in his first cartoon appearance ?,ENTY
How does marl form and what mineral does it contain ?,DESC
What is `` the only cigarette made with no leftovers '' ?,DESC
What is the name of the planet that the Ewoks live on ?,LOC
What is the size of Argentina ?,NUM
What currency is used in Australia ?,ENTY
How do I find a snowboarding website ?,DESC
Who invented the radio ?,HUM
What were the trials called which followed World War II ?,ENTY
"What incident of 1933 did the German Nazis use to justify emergency decrees , imprisoning opponents and vesting more power in themselves ?",ENTY
Name the lawyer for Randy Craft .,HUM
What chapter of Gone with the Wind has Rhett Butler leaving Scarlett O 'Hara ?,NUM
What nationality is a Sicilian ?,LOC
Who made the first gas engine ?,HUM
What is the size of the student body at the University of Massachusetts in Amherst ?,NUM
What is the abbreviation of the company name ` General Motors ' ?,ABBR
"What sport features slotbacks , tailbacks , and touchbacks ?",ENTY
Where is the location of the Orange Bowl ?,LOC
What Jewish holiday saw the start of the 1973 Mideast War ?,ENTY
What is a bone marrow transplant meant for ?,DESC
Where is the Kentucky Horse Park ?,LOC
What department store heir is responsible for raising a three-ton safe from the underwater wreckage of the Andrea Doria ?,HUM
Name a film that has won the Golden Bear in the Berlin Film Festival ?,ENTY
How does Belle describe her life in Beauty and the Beast ?,DESC
What do you know about multicultural and multilingual schools ?,DESC
What painter popularized soup cans and Brillo soap pad boxes ?,HUM
What is the `` Global Economy '' ?,DESC
What country is located at 13 degrees North latitude and 10 degrees East longitude ?,LOC
How much in miles is a ten K run ?,NUM
What President once told Gene Autry : `` Please give my regards to your wife Dale '' ?,HUM
What Nevada center has been dubbed The Biggest Little City in the World ?,LOC
What soft drink is most heavily caffeinated ?,ENTY
What 's the home of the Rockettes ?,LOC
Who made Stonehenge ?,HUM
How did Bob Marley die ?,DESC
What gate opened on East and West Berlin ?,LOC
What TV game show once saw a contestant admit to picking his toes in the shower ?,ENTY
Where is Procter & Gamble headquartered in the U.S. ?,LOC
Who made the largest cocaine seizure in Ventura County history ?,HUM
Who portrayed Renaud in Casablanca ?,HUM
