text,label
What does the name Shawn mean ?,DESC
What is `` alternative '' anymore ?,DESC
"What singer became despondent over the death of Freddie Prinze , quit show business , and then quit the business ?",HUM
What hard-of hearing artist painted Sunflowers ?,HUM
What is the largest city in the world ?,LOC
"What U.S. state boasts Stone Mountain , the world 's largest mass of exposed granite ?",LOC
What city 's airport is named Logan International ?,LOC
Where is the biggest bell ?,LOC
Who created the monster in Mary Shelley 's novel Frankenstein ?,HUM
In what year did Ireland elect its first woman president ?,NUM
Name the Ranger who was always after Yogi Bear .,HUM
"What are the world 's three largest oceans , in order of size ?",LOC
What man-made waterways is 1.76 miles long ?,LOC
In what part of the world is Mozambique ?,LOC
What country are you in if you woo in the Wu dialect ?,LOC
How do you fix squeaky floors ?,DESC
To what does Microsoft 's Windows 3 owe its success ?,ENTY
What non-alcoholic syrup is made from pomegranate juice ?,ENTY
Name a novel written by John Steinbeck .,ENTY
What school does Tom attend in Tom Brown 's School Days ?,HUM
What infectious disease is the world 's deadliest ?,ENTY
What is the Internet2 ?,DESC
How many horses died during the civil war ?,NUM
What baseball player was known as Charley Hustle ?,HUM
Who played Sally Rogers on The Dick Van Dyke Show ?,HUM
What is Michael Jackson 's father 's name ?,HUM
What square is the geographical center of London ?,LOC
Where 's Montenegro ?,LOC
Where is McCarren Airport located ?,LOC
Who fired Maria Ybarra from her position in San Diego council ?,HUM
How many home runs did Lou Gehrig have during his career ?,NUM
What are the rules to `` snow golf '' ?,DESC
What do you get by mixing gin and vermouth ?,ENTY
What is the abbreviation for micro ?,ABBR
What is Dudley Do-Right 's horse 's name ?,ENTY
What is Larry King 's job ?,HUM
What is the dialogue circle in cartoons called ?,ENTY
Who was the first American citizen awarded the Albert Medal of the Society of Arts ?,HUM
What was the name of the 1899 policy forced on China by which all nations had equal trading rights ?,ENTY
What color beans did the ancient Romans refuse to eat ?,ENTY
How many years is Johnnie Walker Black Label aged ?,NUM
What 's the world 's largest cathedral ?,LOC
What spice do chefs pay the most for ?,ENTY
What explorer was nicknamed Iberia 's Pilot ?,HUM
How do vending machines tell if your dollar is a 1 or a 5 ?,DESC
What Kenyan city is the safari center for East Africa ?,LOC
"What events happened January 26 , 1978 ?",ENTY
Why didn 't European colonial rule spread until after the first and second industrial revolutions ?,DESC
What is the origin of the word `` sideburns '' ?,DESC
What does e=mc2 mean ?,DESC
What brand of jeans did Calvin Klein admit in a 1984 interview he felt more comfortable wearing ?,ENTY
Which of the five senses develops first ?,ENTY
What musical instrument did Sherlock Holmes play ?,ENTY
What does EKG stand for ?,ABBR
What is the largest snake in the world ?,ENTY
Where can you find the Venus flytrap ?,LOC
What 's the literary term for a play on words ?,ENTY
How old was Gene Siskel ?,NUM
Who wrote Unsafe at Any Speed ?,HUM
Where are the busiest Amtrak rail stations in the U.S. ?,LOC
"What feathered cartoon characters do Yugoslavians know as Vlaja , Gaja , and Raja ?",HUM
What is a society ruled by elders ?,HUM
What World War II leader declared : `` The blow has been struck '' ?,HUM
What two countries share the Khyber Pass ?,LOC
What can communications satellites offer yachts ?,ENTY
"What is the population of Arcadia , Florida ?",NUM
Who is Pia Zadora 's millionaire husband and mentor ?,HUM
What is spaceball played on ?,DESC
What is Bill Gross 's email address ?,LOC
How long is Camptown Racetrack ?,NUM
What is a fear of women ?,ENTY
Who are the top ten richest people in the world ?,HUM
What can be done about snoring ?,DESC
How many syllables are there in a line of hendecasyllabic poetry ?,NUM
What was the role of the Medieval Guild ?,HUM
What is the protagonist 's name in Dostoevski 's `` The Idiot '' ?,HUM
Where was Tesla born ?,LOC
What is the time it takes a typist to type a screenplay that is 100 pages long ?,NUM
What is the only primate to lack pigment in the palms of its hands ?,ENTY
How can I transport files from one computer to another ?,DESC
What is Shalom ?,DESC
What part did Benjamin Franklin play in the development of the newspaper in America ?,HUM
Who was the lead actress in the movie ` Sleepless in Seattle ' ?,HUM
What medium is Stuart Hamblen the first singing cowboy in ?,ENTY
What is the exchange rate between England and the U.S. ?,NUM
What is the deepest area of the Arctic Ocean ?,LOC
What does a topophobic actor suffer from ?,ENTY
"How much does it cost , average or whatever is available , to produce and send junk mail catalogues in the US ? , DT CD NN NN ,",NUM
How many Superbowls have the ers won ?,NUM
Name the country of giants twelve times the size of man in `` Gulliver 's Travels . '',LOC
What is the best way to overcome a fear ?,ENTY
Where can I get cotton textiles importer details ?,LOC
Who was the star witness at the Senate Watergate hearings ?,HUM
What is leukemia ?,DESC
What is Nicholas Cage 's profession ?,HUM
What South Korean city is served by Kimpo International Airport ?,LOC
What is a caldera ?,DESC
"What river flows through Vienna , Budapest and Belgrade ?",LOC
What is the name of Jamiroquai new album ?,ENTY
What is the name of the city that Maurizio Pellegrin lives in ?,LOC
How many equal sides are there on a scalene triangle ?,NUM
In which year was the cartoon character Chilly Willy created ?,NUM
How much did the Iran-Contra investigation cost ?,NUM
What is a First World country ?,DESC
What 's the Red Planet ?,DESC
What was the name of the U.S. Navy gunboat in the film The Sand Pebbles ?,ENTY
What university football team did O.J. Simpson take to the Rose Bowl ?,HUM
Who led the opposition when Konrad Adenauer was Chancellor in Germany ?,HUM
How much stronger is the new vitreous carbon material invented by the Tokyo Institute of Technology compared with the material made from cellulose ?,NUM
What is Compaq 's mission statement ?,DESC
What was the name of Baretta 's cockatoo ?,ENTY
How many times larger than life size is the Statue of Liberty ?,NUM
What is a fear of reptiles ?,ENTY
What time does Wee Willie Winkie run through the town ?,NUM
How do you determine if a computer monitor has an SVGA adapter ?,DESC
From what cause does tuberculosis stem ?,DESC
What color of dry wine should be served with veal roasts and chops ?,ENTY
What was a Mae West on a World War II battleship ?,DESC
What is the acronym for the National Bureau of Investigation ?,ABBR
What are the top five oil-producing countries in the world ?,LOC
Where did Hillary Clinton graduate college ?,LOC
When was the first Barbie produced ?,NUM
"What 1942 espionage movie reunited director John Huston with Maltese Falconers Humphrey Bogart , Mary Astor , and Sidney Greenstreet ?",ENTY
What are the highest-paying odds on a roulette table ?,NUM
What does verdandi mean ?,DESC
What is the origin of `` jiggy '' as in getting jiggy with it ?,DESC
What continent 's name appears on the upper left corner of a Budweiser label ?,LOC
"How many people have been killed in wars , armed conflicts ?",NUM
What causes canker sores in the mouth ?,DESC
What is habeas corpus ?,DESC
What kind of wine is Spumante ?,ENTY
"What European country boasts the city of Furth , found where the rivers Rednitz and Pegnitz converge ?",LOC
What is a phalanx ?,DESC
"Where can I find all the information I need to know about the English Civil War , 1642-1649 , ?",LOC
What is the purpose of the SysRq key on my computer keyboard ?,DESC
Which member of Charlie 's Angels sang vocals for Josie and the Pussycats ?,HUM
Why do magnets attract ?,DESC
Where can I buy a hat like the kind Jay Kay from Jamiroquai wears ?,LOC
Where is Los Vegas ?,LOC
What North American city would you visit to see Cleopatra 's Needle ?,LOC
Which of the following celebrities was not born in Philadelphia ?,HUM
Where 's the GUM department store ?,LOC
What makes popcorn pop ?,DESC
What have you not let a tennis ball do if you volley ?,DESC
Where can I find a case on Individuals with Disabilities Education Act of 1991 ?,LOC
What does a pedometer measure ?,ENTY
What film featured Shirley MacLaine as a prostitute and Jack Lemmon as a pimp ?,ENTY
Where are there aborigines ?,LOC
What film opens with an assassin tumbling from the Seattle Space Needle ?,ENTY
How much did Varian Associates try to sell its vacuum products division to the BOC group for ?,NUM
What Pope inaugurated Vatican International Radio ?,HUM
How much of the silver production is manufactured by independent silversmiths ?,NUM
What color were their horses ?,ENTY
What is the weather like on the moon ?,DESC
What was Marilyn Monroe 's real name ?,HUM
Who was the second man to walk on the moon ?,HUM
Where on the Internet can I get information about the Fifth Amendment on the American Bill of Rights ?,LOC
What does ` PSI ' stand for ?,ABBR
What was Darth Vader 's son named ?,HUM
What company has built more than 2.5 billion little green houses since 1935 ?,HUM
How long do cardinal eggs incubate ?,NUM
What is platinum ?,DESC
How many gallons of water go over Niagra Falls every second ?,NUM
What is the nickname of the famous flyer who mistakenly flew to Ireland instead of to Los Angeles ?,HUM
How is Easter Sunday 's date determined ?,DESC
How many islands make up Antigua ?,NUM
How do I find out what cities are in a certain area code ?,DESC
What are the diseases that can be cured by black cumin ?,ENTY
How do you do a bibliography page ?,DESC
What is the `` coppertop '' battery ?,DESC
Where can I find full written draft of CTBT ?,LOC
What is the name of David Letterman 's dog ?,ENTY
How do you send a movie transcript to Hollywood so that it can be produced into a film ?,DESC
What is the historical relationship of Catholic Church and bingo ?,DESC
By how much will the California state gas tax rise by the year 2000 ?,NUM
What character narrates Treasure Island ?,HUM
Where is Mozambique located ?,LOC
What year did the War of 1812 begin ?,NUM
How can your school march in the Macy 's Thanksgiving Parade ?,DESC
What is the largest city in Germany ?,LOC
What Homerian epic chronicles events toward the end of the Trojan Wars ?,ENTY
What scale measures earthquakes ?,ENTY
Which Doonesbury character was likely to turn into a werewolf ?,HUM
What is making love ?,DESC
What 's the term for any four-sided figure ?,ENTY
What country did the Romans call Hibernia ?,LOC
What started in 1849 when gold was discovered at Sutter 's Mill ?,ENTY
What director made one silent and one sound version of The Ten Commandments ?,HUM
What is the chemical composition of a Barbie ?,ENTY
How many sonnets did Shakespeare write ?,NUM
What two countries are separated by the Bering Strait ?,LOC
What is the origin of the word Ozymandias ?,DESC
What is the most common name ?,HUM
How do you write MLA style bibliographies for an Internet source ?,DESC
What future President became Senate majority whip under Harry Truman ?,HUM
How do you handle a hungry man ?,DESC
"What is the mean income of the top 10% , top 5% , and top 1% ?",NUM
How fast must a spacecraft travel to escape Earth 's gravity ?,NUM
Who makes the `` cross-your-heart bra '' ?,HUM
What New England state carries the telephone area code 27 ?,LOC
"In Kafka 's Metamorphosis , the hero awakes one morning to find himself turned into what ?",ENTY
What future movie treat was introduced to American colonists in 1603 by Native Americans ?,ENTY
What title did Shevardnadze have during the Soviet era ?,HUM
What holidays or observances are celebrated in Italy ?,ENTY
What 's the most popular form of bridge ?,ENTY
What does Playboy title its `` continuing dialog on contemporary issues between Playboy and its readers '' ?,ENTY
What are the words to the song sung by `` Banana in Pajamas '' ?,DESC
Who is Langston Hughes ?,HUM
Name the men 's cologne that is associated with the sea .,ENTY
Who holds the NFL record for most touchdowns in a season ?,HUM
What program do I need to run a .tbk file ?,ENTY
What was the tallest building in America in 1922 ?,LOC
What political party is Sinn Fein a part of ?,HUM
What was the name of the Titanic 's captain ?,HUM
What attracts tourists to Reims ?,LOC
What was the name of the Protestant revolt against the supremacy of the Pope ?,ENTY
"What is the history of Hot Wheels cars , and how are they produced ?",DESC
How many milliseconds in a second ?,NUM
Who commanded the French forces at the Battle of Orleans ?,HUM
How big is a quart ?,NUM
"What makes Black Hills , South Dakota a tourist attraction ?",DESC
How much caffeine is in a 16 oz cup of coffee ?,NUM
What kind of species is the monster in the film `` Jaws '' ?,ENTY
What feminist wrote Sexual Politics and Flying ?,HUM
What did Englishman John Hawkins begin selling to New World colonists in 1562 ?,ENTY
What is `` bloodhound '' ?,DESC
How many queen bees reign in a hive ?,NUM
What was the first TV set to include a remote control ?,ENTY
What is a fear of sinning ?,ENTY
For what reason did some San Diego schools stop serving apples ?,DESC
What 's the second-largest island in the world ?,LOC
Who declared : `` I think I 'll go out and milk the elk '' ?,HUM
"Name the poet of the poem which begins : I do not know much about gods ; but I think that the river Is a strong brown god-sullen , and untamed ?",HUM
How much do tuberculosis combatting drugs cost ?,NUM
How do Ouija Boards work ?,DESC
How close a cousin was Franklin D. to Theodore Roosevelt ?,DESC
What are the world 's four oceans ?,LOC
What are the side effects of mevacor ?,DESC
What are the Poconos ?,DESC
What are amicable numbers ?,DESC
What is the frequency of VHF ?,NUM
What is the name of the tallest mountain in the world ?,LOC
Where do you find information about the Queensland National Competition Policy,LOC
Who is Prince Naseem Hamed ?,HUM
What is the capital of California ?,LOC
How many consecutive baseball games did Lou Gehrig play ?,NUM
How many Grammys did Michael Jackson win in 1983 ?,NUM
Why does it say on children 's cough syrup not to drive while using this medication ?,DESC
Rotary engine cars were made by what company ?,HUM
What heavyweight boxer was known as The Wild Bull of the Pampas ?,HUM
What is the difference between classical conditioning and operant conditioning ?,DESC
What does BTU mean ?,ABBR
Where is the Thomas Edison Museum ?,LOC
What is Java ?,DESC
How many feet high is the hurdle in front of a runner 's steeplechase water jump ?,NUM
Where can I get information about cystic fibrosis ?,LOC
What does Inuit and Eskimo mean ?,DESC
"What prison is found in Ossining , New York ?",LOC
How can you define time ?,DESC
What direction do most baseball pitchers pitch toward ?,LOC
Name the scar-faced bounty hunter of The Old West .,HUM
What former African leader held his country 's boxing title for nine years ?,HUM
In what ways did Ivan IV support Russian expansion ?,ENTY
What was the Chivington Massacre ?,DESC
How many real fruit juices are there in a can of Hawaiian Punch ?,NUM
What is the abbreviated form of the National Bureau of Investigation ?,ABBR
How long does it take for your blood to make one complete trip through the body ?,NUM
What percentage of Americans own their homes ?,NUM
Who wrote ` Dubliners ' ?,HUM
What chemicals are used in lethal injection ?,ENTY
What was spawned the term `` MiG Alley '' ?,ENTY
What is time ?,DESC
How many different types of skunks are there ?,NUM
Who is Charles Lindbergh ?,HUM
Where can I find the history of the Hungarian language ?,LOC
In what country is Lund ?,LOC
Name the blind sculptress in love with the Fantastic Four 's Thing .,HUM
Who was Lauren Bacall 's first husband ?,HUM
"How many megawatts will the power project in Indonesia , built by a consortium headed by Mission Energy of US , produce ?",NUM
What are pushed and coupled in hump yards ?,ENTY
What does CPR stand for ?,ABBR
What is Cabarnet Sauvignon ?,DESC
How loud is thunder ?,NUM
What happened during the Blackhawk Indian war of 1832 ?,DESC
What international organization was founded by Clara Barton ?,HUM
How many thousands of students attend the University of Massachusetts ?,NUM
What kind of patent did Ermal Fraze get in 1963 ?,ENTY
How do you make the color purple ?,DESC
"How can people from Ireland come to the U.S. , work , and then return to Ireland ?",DESC
What is SVHS ?,ABBR
Who was the first person to study the stars ?,HUM
What U.S. state is Dixville Notch in ?,LOC
What non-mechanical sport achieves the highest speeds ?,ENTY
Where does the weird shape of the dinner fish knife originate from ?,LOC
How many months does it take the moon to revolve around the Earth ?,NUM
What Kennedy was married to Ethel ?,ENTY
How many pairs of legs does a lobster have ?,NUM
What was the education system in the 1960 's ?,ENTY
How long does a human live ?,NUM
What line divided the North and South in the U.S. Civil War ?,ENTY
"In AD 999 , what sort of celebrations , fears , were there ?",ENTY
How long ago did the Anglican church part from the Vatican ?,NUM
What is the Motto for the State of Maryland ?,DESC
How many websites are there in the world ?,NUM
How much did a knight 's armor weigh ?,NUM
Which college did Dikembe Mutombo play basketball for ?,HUM
What is the largest city in Connecticut ?,LOC
What state has the most Indians ?,LOC
What is the approximate weight of a teaspoon of matter in a black hole ?,NUM
Where did the Wright brothers make their first flight ?,LOC
What is the most popular sports car color ?,ENTY
Who invented batteries ?,HUM
What organization is the Security Council a part of ?,HUM
What year did Spielberg make `` Jaws '' ?,NUM
What planet gave bith to Superman ?,LOC
Name an art gallery in New York .,LOC
What U.S. city is The Queen of the Pacific ?,LOC
"What was the name given the 6 , 500 German airforce troops that used the Spanish Civil War as a training exercise ?",HUM
What two countries contain Sierra Nevada mountains ?,LOC
How many layers does a bottle of Yoo-Hoo settle into ?,NUM
Where can I find information on the cyclone that hit New Jersey on 8/28/1941 ?,LOC
How many milligrams are in a gram ?,NUM
How many flavors does Baskin & Robbins offer ?,NUM
Who was President of Costa Rica in 1994 ?,HUM
How did Asia get its name ?,DESC
What actor dressed up as Santa Claus and had a once-a-year affair with actress Shelley Winters every Christmas for many years ?,HUM
What is witch hazel ?,DESC
How long were Tyrannosaurus Rex 's teeth ?,NUM
Who invented the toothbrush ?,HUM
"What Robert Louis Stevenson novel was inspired by Deacon William Brodie , a cabinetmaker by day and burglar by night ?",ENTY
What was the name of the U.S. 's first manned space program ?,ENTY
Which high schools are included in the South Florida Ice Hockey league ?,HUM
What was the name of Roy Rogers 's dog ?,ENTY
What is the classic definition of tragic hero ?,DESC
"What cigarette company urged us , `` Come to where the flavor is ? ''",HUM
Where is the Virtual Desk Reference ?,LOC
How many flavors of ice cream does Howard Johnson 's have ?,NUM
How do boats float ?,DESC
What articles of clothing are tokens in Monopoly ?,ENTY
What are the words to `` My Way '' written by Paul Anka ?,DESC
What animals do you find in the stock market ?,ENTY
What kind of rocket launched the Surveyor spacecraft ?,ENTY
What are some important events of the 1830 's ?,ENTY
What is digitalis ?,DESC
What 's the No. 1 killer in industrialized countries ?,ENTY
What chapter of the Bible has the most verses ?,NUM
What African country was founded by freed American slaves in 1847 ?,LOC
Who played the title role in The Romantic Englishwoman ?,HUM
What nationality was Jackson Pollock ?,LOC
What is Spumante ?,DESC
How many degrees cooler is the inside of a cucumber than the air outside ?,NUM
"How do you say , `` I love you '' in other languages ?",ENTY
Who wrote `` The Pit and the Pendulum '' ?,HUM
What is the biblical meaning of ` stones ' ?,DESC
What was the player 's name who played nose tackle for the Eagles in Super Bowl XV ?,HUM
What is the term for the sum of all genetic material in a given organism ?,ENTY
What was Hitler 's favorite movie ?,ENTY
What is the celtic symbol for `` life '' ?,ENTY
What does `` Semper Fidelis '' mean ?,DESC
Who directed the first Woody Woodpecker cartoon ?,HUM
What hockey player did Ronald Reagan joke he would swap Texas for ?,HUM
Name the only extant trilogy of classical Greek plays .,ENTY
What bowl game began as an East-West contest between Michigan and Stanford in 192 ?,ENTY
What are amphibians ?,DESC
How old is the universe ?,NUM
What 's distinctive about a palmiped 's feet ?,DESC
What are the first ten amendements passed ?,ENTY
What are the largest breweries in the world ?,LOC
What function does a community 's water tower serve ?,DESC
What is a golf ball made of ?,ENTY
Who was Sherlock Holmes 's archenemy ?,HUM
"What is the name of the largest city in Chile , South America ?",LOC
What product on the market is good for hiding facial scars ?,ENTY
What Texas city got its name from the Spanish for `` yellow '' ?,LOC
What did the ancients call the four great elements ?,ENTY
"What is a fear of odors , body , ?",ENTY
Give a reason for American Indians oftentimes dropping out of school .,DESC
Which city in Canada is the least-populated ?,LOC
How many people watch network television ?,NUM
"What are the words to the cd Eminem 's , or slim shady , `` My Name Is '' ?",DESC
What is predicted to topple over between 2010 and 2020 ?,ENTY
"When not adventuring on Rann , what does Adam Strange call his profession ?",HUM
What do peacocks mate with ?,ENTY
Who invented Make-up ?,HUM
Who created private detective Philip Marlowe ?,HUM
What room did W.C. Fields keep his library in ?,LOC
What 's the highest-ranking suit in bridge ?,ENTY
How does ultraviolet light damage the DNA of skin cells ?,DESC
When did the last Americans leave Vietnam ?,NUM
What field sport did dentist William Beers promote and write a standard book of rules for ?,ENTY
Who declared : `` I am down on whores and I shan 't stop ripping them '' ?,HUM
How many people was Randy Craft convicted of murdering ?,NUM
What is a pyrotechnic display ?,DESC
Why is Chicago named Chicago ?,DESC
In what medium is Stuart Hamblen considered to be the first singing cowboy ?,ENTY
What British monarch 's lap did P.T. Barnum 's Tom Thumb sit in ?,HUM
What cigarette is `` a whole new world '' ?,ENTY
Who was Quetzalcoatl ?,HUM
How does one correctly pronounce ` qigong ' ?,DESC
Where can I find the history of the Taiwanese language ?,LOC
What Nazi leader killed himself in jail just before he was to be executed as a war criminal ?,HUM
What is the real name of disc jockey `` Wolfman Jack '' ?,HUM
What were the achievements of Richard Nixon ?,ENTY
Why do movie and TV stars get paid so much ?,DESC
"What country covers 8 , 600 , 387 square miles ?",LOC
What country imposed the Berlin Blockade in 1948 ?,LOC
What percentage of children between the ages of two and eleven watch ` The Simpsons ' ?,NUM
Which police department made the largest cocaine seizure ever in Ventura County ?,HUM
What are Christopher Marlowe 's and Shakespeare 's literary contributions to English literature ?,DESC
What are the top boy names in the U.S. ?,HUM
What is the current ticket fare from from Cairo to Barbados ?,NUM
What is the origin of thank you notes ?,DESC
What is the exchange rate for Australian to American money ?,NUM
"Who portrayed Etta Place , companion to Butch Cassidey and the Sundance Kid ?",HUM
What constitutes an adult ?,ENTY
How many small businesses are there in the United States ?,NUM
What is the difference between the anus and the rectum ?,DESC
What is dew point ?,DESC
What are the languages spoken by the natives in Afghanistan ?,ENTY
Who claimed to be the world 's most perfectly-developed man ?,HUM
What is a Chinese `` spouting '' bowl ?,DESC
What cathedral was Thomas Becket murdered in ?,LOC
How many lakes are there on the Earth ?,NUM
How many cards are dealt to each player in Gin Rummy ?,NUM
Who is the leader of Brunei ?,HUM
What famed clown appeared on an early Howdy Doody Show and insisted that Clarabell be made up as a real clown ?,HUM
What is Mikhail Gorbachev 's middle initial ?,ABBR
What 4-foot-9 actress in 1984 became the first performer to win an Oscar for playing a character of the opposite sex ?,HUM
"What clause in the U.S. Constitution may not be changed , altered or amended ?",DESC
What company uses the unfamiliar faces of its celebrity spokespeople to promote the use of its product ?,HUM
What are my legal rights in an automobile repossession in California ?,DESC
What is Nitrox diving ?,DESC
What does 7847+5943 equal ?,NUM
How do I start a bank ?,DESC
What was the name of the `` Little Rascals '' dog ?,ENTY
When did Mount St. Helens last erupt ?,NUM
Who invented the fountain ?,HUM
What football coach 's story was told in the movie Run to Daylight ?,HUM
What was the outcome of the 1945 Yalta Conference ?,DESC
What is the average salary of a paleontologist ?,NUM
How do I find a web address for a company ?,DESC
"What disease plagued Europe , Africa and Asia ?",ENTY
What is damage to business and government caused by bureaucracy ?,ENTY
When did the use of `` the syringe '' first appear in medicinal history ?,NUM
Who was the star of Leave It to Beaver ?,HUM
