text,label
Who replies `` I know '' to Princess Leia 's confession `` I love you '' in The Empire Strikes Back ?,HUM
"What is the name of the rare neurological disease with symptoms such as : involuntary movements , tics , swearing , and incoherent vocalizations , grunts , shouts , etc. ?",ENTY
How many miles of corridors are in The Pentagon ?,NUM
What cocktail inspired John Doxat to write the book Stirred-Not Shaken ?,ENTY
How does the tail affect the flight of a kite ?,DESC
In 139 the papal court was forced to move from Rome to where ?,LOC
What are the major differences in the Catholic and Methodist religions ?,DESC
Which mayonnaise refers to itself as `` real '' mayonnaise ?,ENTY
What is Jell-O made from ?,ENTY
When will Jean Aeul publish her next book ?,NUM
What century does Captain Video live in ?,NUM
What does the `` blue ribbon '' stand for ?,ABBR
What is a hyperlink ?,DESC
What is the highest waterfall in the United States ?,LOC
What does BMW stand for ?,ABBR
When did Fraze get his first patent for the pull-tab can ?,NUM
What is President Nixon 's birthdate ?,NUM
Who was the star of the 1965 Broadway hit Golden Boy ?,HUM
How deep is a fathom ?,NUM
What was the name of the lawyer who represented Randy Craft ?,HUM
What tennis term is said to come from the French word for egg ?,ENTY
What is saltpeter ?,DESC
In what year was the cannon invented ?,NUM
How many dogs pull a sled in the Iditarod ?,NUM
Who appointed the chair of the Federal Reserve ?,HUM
What 's the U.S. Navy hymn ?,ENTY
What does U.S.S.R. stand for ?,ABBR
Which is heavier - cream or milk ?,ENTY
How does the Elongated Man know a mystery is afoot ?,DESC
What is the plural of gulf ?,ENTY
What country did the Allies invade in World War II 's Operation Avalanche ?,LOC
Where did the Mayan Indians live ?,LOC
Where can I learn about Samuel Gompers ?,LOC
"Who manufactures the software , `` PhotoShop '' ?",HUM
Which one of the original seven Mercury program astronauts did not fly on any of the Mercury flights ?,HUM
What 's the term for a young fox ?,ENTY
How old was Sir Edmund Hillary when he climbed Mt. Everest ?,NUM
What actor has a tattoo on his right wrist reading Scotland Forever ?,HUM
Name the various super-teams to which the Angel has belonged .,HUM
What is the current unemployment rate in the U.S. ?,NUM
How often are quadruplets born ?,NUM
Who plays shortstop for Charlie Brown 's baseball team ?,HUM
What two baseball players make up the battery ?,HUM
Where does your hair grow the fastest ?,ENTY
What college produced the most winning Super Bowl quarterbacks ?,HUM
When was the first railroad from the east coast to the west coast completed ?,NUM
What causes `` rolling thunder '' ?,DESC
How many pounds are there in a stone ?,NUM
Where do quality drinks begin ?,LOC
What season does a hiemal activity normally take place in ?,NUM
The trials resulting from World War II are known as what ?,ENTY
Who is the prophet of the religion of Islam ?,HUM
"What was Suzy Parker doing to earn $1 , 000 in the early 1950 's ?",DESC
Which NBA players had jersey number 0 ?,HUM
What was the name of the US helicopter pilot shot down over North Korea ?,HUM
What is a fear of disease ?,ENTY
How much did Alaska cost when bought from Russia ?,NUM
What month did the Edmund Fitzgerald sink ?,NUM
What jockey won 17 Triple Crown races ?,HUM
What 1956 Grace Metalious novel was on the best-seller list for two years ?,ENTY
In what religion was Isis the nature goddess ?,ENTY
Who discovered electricity ?,HUM
How tall is the Matterhorn ?,NUM
What chess outcome results when a player has no legal move ?,ENTY
Why is Microsoft 's Windows 3 software so successful ?,DESC
How many types of lemurs are there ?,NUM
Who produces Spumante ?,HUM
What year did the United States pass the Copyright law ?,NUM
What line of candy products included Super Skrunch and Peanut Butter Oompas ?,ENTY
"What was the claim to fame of the football game that saw Fordham defeat Waynesburg State 12601 on September 3 , 1939 ?",DESC
How many bends are there in a standard paper clip ?,NUM
What famed river flows through Bagdad ?,LOC
"What planet would you visit to see Bebrenia , Arcadia , and Amazonis ?",LOC
What radio station did Paul Harvey work for ?,HUM
CNN 's first broadcast occurred on what date ?,NUM
What is the biggest `` thing '' humans have made ?,ENTY
How successful is arometherapy ?,DESC
How many South American countries have the letter Z in their names ?,NUM
What are John C. Calhoun and Henry Clay known as ?,ENTY
What was the eighth day following the Nones in each month of the Roman calendar called ?,ENTY
What U.S. state are the Finger Lakes in ?,LOC
Where can I get information and statistics on countries and nations ?,LOC
What company produces Spumante ?,HUM
When did Theo Rousseau paint the `` Forest of Fontaine '' ?,NUM
What American naval officer broke Japan 's isolationist policy in 1853 ?,HUM
Name a Sioux language .,ENTY
What five cards make up a perfect Cribbage hand ?,ENTY
Who was the author of the novel `` Far From the Madding Crowd '' ?,HUM
Who became president of the U.S. in 1789 ?,HUM
Why is it called `` hamburger '' if there is no ham in it ?,DESC
What did Warlock wear on his forehead in Marvel comics ?,ENTY
What two US biochemists won the Nobel Prize in medicine in 1992 ?,HUM
What New Hampshire hamlet rises early to vote first in U.S. presidential elections ?,LOC
What did Vasco da Gama discover ?,ENTY
How do plants make food ?,DESC
Name four comic strips about pilots .,ENTY
What is the correct way to use `` may '' vs. `` might '' ?,ENTY
What Mary Tyler Moore Show regular came into the world as Tadeus Wladyslaw Konopka ?,ENTY
What country has the highest per capita consumption of cheese ?,LOC
What are the ingredients of Coca-Cola ?,ENTY
Where can I find information on George Bush ?,LOC
What is Chiricahua the name of ?,ENTY
What makes thunder ?,DESC
What is a hormone ?,DESC
How much money can a person be fined for having a dog on a beach ?,NUM
What does an edentulous smile lack ?,ENTY
What are the most common breeding birds in the U.S. ?,ENTY
What does NN O `` mean when used as a prefix in Irish surnames ?,ABBR
Who is the richest woman in the world ?,HUM
What will a compass do in outer space ?,DESC
How do I tie dye clothes ?,DESC
What is the origin of the word nevermind ?,DESC
Who said : `` Soldiers win the battles and generals get the credit '' ?,HUM
What does the term glory hole mean ?,DESC
When did Gothic art and architecture flourish ?,NUM
What are tourist attractions in Reims ?,LOC
Where are the Union Stockyards ?,LOC
What state is known as the Hawkeye State ?,LOC
What Morris West novel deals with Russian bishop who becomes Pope ?,ENTY
What does the policeman become in the Canadian edition of Monopoly ?,ENTY
Who did Sonny Liston succeed as world heavyweight boxing champion ?,HUM
How does lightning travel ?,DESC
Why is Microsoft 's Windows 3 such a successful computer program ?,DESC
"What mystery writer penned `` ...the glory that was Greece , and the grandeur that was Rome '' ?",HUM
"What are the shoe sizes of O 'Neal , Jordan , and Mutombo , the NBA players ?",NUM
What kind of crystals exist ?,ENTY
What is literary criticism ?,DESC
What are the five basic swimming strokes ?,ENTY
What fast food is prepared with a `` secret blend of 11 herbs and spices ? '',ENTY
"Who stopped making diary entries on May 31 , 1669 , because he thought he was going blind ?",HUM
What 1963 Joseph L. Mankiewicz film cost $28 million ?,ENTY
Who is stationed at Camp Swampy in the comic strips ?,HUM
What is the English meaning of caliente ?,DESC
What is Steve Rogers 's profession when he 's not Captain America ?,HUM
What disease did August von Wassermann develop a specific test for in 196 ?,ENTY
What is the name given to the Islamic counterpart of the Red Cross ?,ENTY
What are some science fair projects for 8th graders ?,ENTY
"What day is August 13 , 1971 ?",NUM
What good are mosquitoes ?,DESC
What is AFS ?,ABBR
"What Michelangelo sculpture is in Saint Peter 's Cathedral , Basilica , ?",ENTY
What country 's northernmost city is Darwin ?,LOC
What kind of flowers does detective Nero Wolfe raise ?,ENTY
How do you build a solar car for a high school experiment ?,DESC
What is the meaning of thalassemia ?,DESC
What is the VDRL test of blood ?,DESC
Why do many Native American students not complete college ?,DESC
What apostle is Taylor Caldwell 's Great Lion of God ?,HUM
When did Spain and Korea start ambassadorial relations ?,NUM
What is the name of the Michelangelo painting that shows two hands with fingers touching ?,ENTY
What comedian has a legendary reputation for stealing jokes ?,HUM
What was American folk hero John Chapman 's nickname ?,HUM
Name an American made motorcycle .,ENTY
What is an aurora ?,DESC
"What was the first Funk 'N Lata , Brazilian group , success ?",DESC
What is the probability that at least 2 out of 25 people will have the same birthday ?,NUM
When was `` the Great Depression '' ?,NUM
How many visitors go to the Vatican each year ?,NUM
"What book opens : `` At a certain village in La Mancha , which I shall not name.. . '' ?",ENTY
Who was Maria Theresa ?,HUM
Why is Indiglo called Indiglo ?,DESC
Where can I get a photograph of professor Randolph Quirk ?,LOC
What weapon did the crossed slits in English castles accommodate ?,ENTY
"What TV series saw many of its aquatic scenes shot at Silver Springs , Florida ?",ENTY
Where did Dylan Thomas die ?,LOC
"What is the origin of the midwest slang , ` you 're darn tootin ' ?",DESC
What class of animals makes up more than two-thirds of known species ?,ENTY
Who portrayed Dracula in Hammer Studios ' films ?,HUM
What was the number of assassinations and attempts to assassinate in the U.S. since 1865 ?,NUM
What three colors are on the French flag ?,ENTY
What six-foot temperance advocate wielded her hatchet on saloons ?,HUM
Why was the zipper invented ?,DESC
What organ contains the islands of Langerhans ?,ENTY
What is in baby powder and baby lotion that makes it smell the way it does ?,DESC
"In My Antonia , how is Mr. Shimerda out of place on the farm ?",DESC
What are the benefits of home school ?,DESC
What two animals are specifically mentioned as being in Noah 's Ark ?,ENTY
How old is Bernadette Peters ?,NUM
What is the smallest country in Africa ?,LOC
What is the chemiosmotic theory ?,DESC
What Vladimir Nabokov novel features Professor Humbert in love with a 12-year-old girl ?,ENTY
How many grooves are on a dime 's edge ?,NUM
What woman pitcher has struck out Ted Williams and Hank Aaron ?,HUM
How much money does the Sultan of Brunei have ?,NUM
The operating system that runs on IBM-compatible machines is called what ?,ENTY
How do I sing like Elvis Presley ?,DESC
What is the chemical reactivity of helium ?,NUM
What is a gandy dancer ?,DESC
Who was Camp David named for ?,HUM
What monarch signed the Magna Carta ?,HUM
What does caliente translate to in English ?,ENTY
How do you recognize anorexia ?,DESC
Who is the youngest of the Beatles ?,HUM
What Mexican leader was shot dead in 1923 ?,HUM
What is the quickest and easiest way to get nail polish out of clothes ?,ENTY
What was the infamous feat of Germany 's U-2 submarine ?,DESC
What is goulash ?,DESC
How many fingers are used to draw a bow ?,NUM
What actor 's autobiography is titled All My Yesterdays ?,HUM
What 's the best way to lose the flab under your chin and around your face ?,ENTY
"What Stephen Sondheim ballad ends : `` Well , maybe next year.. . '' ?",ENTY
"Who is the richest person in the world , without owning a business ?",HUM
What auto race was Wilbur Reed the first to win three times ?,ENTY
How big is the Chappellet vineyard ?,NUM
What words in the English have two u 's back to back ?,ENTY
What was John Steinbeck 's travelling companion Charley ?,ENTY
What is your favorite color ?,ENTY
What kind of nuts are used in marzipan ?,ENTY
Colin Powell is famous for what ?,DESC
What is the Homelite Inc. home page ?,LOC
How many sperm cells are in an average ejaculation ?,NUM
Who was William Henry Harrison ?,HUM
"Name a movie that the actress , Sandra Bullock , had a role in .",ENTY
What delicacy is known indelicately as pickled roe ?,ENTY
How is digital audio used ?,DESC
What color are a cherry tree 's flowers ?,ENTY
What 's the meaning of the zoological term ruminant ?,DESC
What do most tourists visit in Reims ?,LOC
What creative genius said : `` Everything comes to him who hustles while he waits '' ?,HUM
What is the origin of thank you notes ?,DESC
What is the largest city in Texas ?,LOC
Why do they call it a `` funny bone '' ?,DESC
How many maids were milking ?,NUM
Who is the president of Bolivia ?,HUM
What Erica Jong novel deals with Isadora Wing 's fear ?,ENTY
"Where can one find information on religion and health , the brain and nutrition ?",LOC
What boxer 's life story is titled Raging Bull ?,HUM
When did Jaco Pastorius die ?,NUM
Who sang the song `` Hooked on a Feeling '' in the dancing baby episode of `` Ally Mcbeal '' ?,HUM
Who protects DC Comics ' realm of dreams ?,HUM
How far out is the universe ?,NUM
What does an irate car owner call iron oxide ?,ENTY
What is the alphabet for Latin ?,ENTY
What are the names of the tourist attractions in Reims ?,LOC
What 's the most common surname in America ?,HUM
Who was made the first honorary citizen of the U.S. ?,HUM
Whose image is alleged to be on The Shroud of Turin ?,HUM
What is the nickname of Pennsylvania ?,LOC
What 's the shape of a camel 's spine ?,ENTY
What does El Nino mean in spanish ?,ENTY
What well-known music personality is the father of an adopted son named Hans Christian Henderson ?,HUM
Who made the first surfboard ?,HUM
Who served as inspiration for the schoolteacher portrayed by Robin Williams in `` Dead Poets Society '' ?,HUM
What is hypnotherapy ?,DESC
How is the new Ford Econoline van F25 V1 engine ?,DESC
Where did the term `` 69 '' come from ?,DESC
Who followed up his first two underwater thrillers with The Girl of the Sea of Cortez ?,HUM
Who betrayed Norway to the Nazis ?,HUM
What is object-oriented design ?,DESC
What famous husband-and-wife team did radio ads for Blue Nun wine ?,HUM
What soft drink tells us to `` Go Hawaiian '' ?,ENTY
A normal human pregnancy lasts how many months ?,NUM
What game do Steve McQueen and Edward G. Robinson play in The Cincinnati Kid ?,ENTY
Why is hockey so violent ?,DESC
"What are some fun things to do in Cozumel , Mexico for teenagers ?",DESC
Who played the Ringo Kid in the 1939 film Stagecoach ?,HUM
Name a flying mammal .,ENTY
How can I trace my family roots ?,DESC
What was the name of Aristotle Onassis 's yacht ?,ENTY
How do you say `` eat the day '' in Latin ?,ENTY
"What shampoo prevents eczema , seborrhea , and psoriasis ?",ENTY
What is the S&P 500 used for ?,DESC
Who is buried in the great pyramid of Giza ?,HUM
What were the ceremony traditions like during the Elizabethian times ?,ENTY
Where is the Rose Bowl played ?,LOC
Where is McCarren Airport ?,LOC
What two countries is Andorra nestled between ?,LOC
What does the `` c '' stand for in the equation E=mc2 ?,ABBR
Where can I find a picture of a Blue Meanie ?,LOC
What was the name of the orca that died of a fungal infection ?,ENTY
How many hearts does an octopus have ?,NUM
How many rings are there on a five-zone archery target ?,NUM
What are the odds of giving birth to twins ?,NUM
What is a fear of childbirth ?,ENTY
What does the number `` 5 '' stand for on FUBU clothing ?,ABBR
What is real time processing ?,DESC
Who were the Picts ?,HUM
How many gallons of paint does it take to paint the Golden Gate Bridge ?,NUM
What city is Logan Airport in ?,LOC
What dictator has the nickname `` El Maximo '' ?,HUM
What is The Gay Science ?,DESC
What is the acronym for the rating system for air conditioner efficiency ?,ABBR
What is the starting salary of a radiographer ?,NUM
What Catch-22 character is elected mayor of half a dozen Italian cities ?,HUM
How many people lived in Nebraska in the mid 1900s ?,NUM
What does laser stand for ?,DESC
Where can I find a large list of 5 to 6 letter words ?,LOC
What do you call the feeling of having experienced something before ?,ENTY
Name the Four Horsemen of the Apocalypse .,HUM
What toy company is the world 's No.1 maker of female apparel ?,HUM
What is the origin of blue for boys and pink for girls ?,DESC
What 's the traditional drink at the Kentucky Derby ?,ENTY
What is the website for the USA journal ?,LOC
"The italian artist , Maurizio Pellegrin , is how old ?",NUM
When did Hitler come to power in Germany ?,NUM
What is the name of the American literary era that includes 1896 ?,ENTY
Which company created the Internet browser Mosaic ?,HUM
What is the movie Jonathan Livingstone Seagull ?,ENTY
"What is the 401 , K , plan ?",DESC
Why does sound travel quicker through water than air ?,DESC
What city or state do the most gay men live in ?,LOC
How does salt melt ice and snow ?,DESC
What is the largest natural lake in Pennsylvania ?,LOC
What are the main blood vessels ?,ENTY
How can I enforce new rules to a group of youngsters who have been allowed to do as they please .,DESC
When was the Battle of Hastings ?,NUM
Who was President Cleveland 's wife ?,HUM
What is a fear of weakness ?,ENTY
Which company that manufactures video-game hardware sells the `` super system '' ?,HUM
What is the definition of cecum ?,DESC
What Peruvian city is home to the mummified body of Francisco Pizarro ?,LOC
What is the name of the Islamic counterpart to the Red Cross ?,ENTY
What 's the last line of Dickens 's A Christmas Carol ?,DESC
How many pairs of wings does a tsetse fly have ?,NUM
Which is the most-used computer program ?,ENTY
What is the origin of the word `` pallbearer ? '',DESC
On which Hawaiian island is Pearl Harbor ?,LOC
What is a technique popularly used to detect birth defects ?,ENTY
How do I start a web based business ?,DESC
What city does McCarren Airport serve ?,LOC
What actress holds the record for the most appearances on the cover of Life ?,HUM
Who painted the Sistine Chapel ?,HUM
"Who said , `` I shall return . '' during World War Two ?",HUM
What English queen had six fingers on one hand ?,HUM
What is the difference between a bachelor and a 1 bedroom apartment ?,DESC
Who took the toys donated for the Doodyville Orphans ' Fund and kept them for himself ?,HUM
How does a copier work ?,DESC
What Muhammad Ali maneuver was George Foreman the first victim of ?,ENTY
What type of childhood did Jules Verne have ?,DESC
Where was the first restaurant ?,LOC
What President was assassinated by Charles J. Guiteau ?,HUM
What was the first video ever made ?,ENTY
What is Drew Barrymore 's email address ?,LOC
What author of the Days of Our Lives Cookbook signed on in 198 as Liz Chandler in TV 's Days of Our Lives ?,HUM
What is the belt of low pressure around the equator called ?,ENTY
What is thermal equilibrium ?,DESC
What was the claim to fame of King Camp Gillette ?,DESC
What is a fear of stings ?,ENTY
What does a phobophobe fear ?,ENTY
What is the name of the woman who was with John Belushi when he died ?,HUM
How many muscles does an oyster have ?,NUM
Whom did the Chicago Bulls beat in the 1993 championship ?,HUM
What year was Desmond Mpilo Tutu awarded the Nobel Peace Prize ?,NUM
Why did the Anglican church split from the Vatican ?,DESC
"What late-night TV show features Larry , Bud , Melman and Toast on a Stick ?",ENTY
What are tonsils for ?,DESC
What was the filling in the first golf balls ?,DESC
What is a ball that hits the foul pole called ?,ENTY
What is dry ice ?,DESC
What army was founded by William Booth and his wife Catherine ?,HUM
How many different languages are spoken in Europe ?,NUM
Who told all in Ball Four ?,HUM
What are the only two states that incorporate the Confederate battle flag in their flags ?,LOC
Who was Randy Steven Craft 's lawyer ?,HUM
What National League baseball team employed 72 third baseemen in its first 2 seasons ?,HUM
How many dollars a day did Arthur Frommer say you could get by on in Europe in 1968 ?,NUM
What movie has made the most money ?,ENTY
Who is the fastest swimmer in the world ?,HUM
Who is Robin Williams ?,HUM
How can you tell if someone is lying ?,DESC
What is Nero Wolfe 's favorite drink during office hours ?,ENTY
What is the recomended age to switch a child from a crib to a bed ?,NUM
Who succeeded Nikita Khrushchev as first secretary of the Communist Party ?,HUM
"In Dana 's `` Two Years Before the Mast , '' what seafarers lived in an abandoned oven on the beach at San Diego ?",HUM
What Japanese electronics company was named for a coastal city northeast of Tokyo ?,HUM
How many calories are there in soy sauce ?,NUM
When did communist control end in Hungary ?,NUM
What is the estimated total U.S. whitetail deer population ?,NUM
Which Bourbon king was restored to the French throne during Napoleon 's abdication ?,HUM
What is a fear of trees ?,ENTY
What is an example of a famous rock band from the sixties ?,HUM
What mustachioed comedian portrayed Frankie in North to Alaska ?,HUM
What were popular songs and types of songs in the 1920s ?,ENTY
What was the previous name for the Commonwealth ?,HUM
What did John F. Kennedy consider his greatest blunder in office ?,DESC
Who were John F. Kennedy 's dogs ?,ENTY
What comedian was banned from the Ed Sullivan Show for allegedly making an obscene gesture at the show 's host ?,HUM
Who portrayed portly criminologist Carl Hyatt on Checkmate ?,HUM
"How many people on the ground were killed from the bombing of Pan Am Flight 103 over Lockerbie , Scotland , December 21 , CD .",NUM
Who was Scrooge 's dead partner in Dickens 's A Christmas Carol ?,HUM
What city did the Flintstones live in ?,LOC
In what film did Steven Spielberg 's dog star as the main character 's dog ?,ENTY
Who was the inventor of the stove ?,HUM
What was the name of Robert Fulton 's most famous steamboat ?,ENTY
What 's the name of the Tampa newspaper ?,ENTY
Who wrote The Collector ?,HUM
What car was driven in the 199 release of `` Smokey and the Bandit '' ?,ENTY
What countries have the best math students ?,LOC
Name the On Stage character whose face was never seen .,HUM
What U.S. city was named for St. Francis of Assisi ?,LOC
Jude Law acted in which film ?,ENTY
What are the ten safest American cities for pedestrians ?,LOC
When was London 's Docklands Light Railway constructed ?,NUM
How do I find a city if I have the area code ?,DESC
How do chickens have baby chicks ?,DESC
Where is one 's corpus callosum found ?,LOC
How much caffeine is in a 16 oz cup of coffee ?,NUM
Where are the busiest ports in the world ?,LOC
What would you add to the clay mixture to produce bone china ?,ENTY
"What blew up at Lakehurst , New Jersey , on May 6 , 1977 ?",ENTY
Where is Windsor Castle ?,LOC
"What became the biggest cash crop in the U.S. in 1983 , surpassing corn ?",ENTY
What is Britain 's possession on the Chinese mainland ?,LOC
Who is the Prophet of Medina ?,HUM
Why does tuberculosis afflict people ?,DESC
Mississippi has what name for a state nickname ?,LOC
What causes pneumonia ?,DESC
What is the population of Ohio ?,NUM
Where on the Internet can I find a song lyrics database similar to the International Lyrics Server ?,LOC
What are the cookies in Internet ?,DESC
When does the Bible say the seasons started ?,NUM
What is the capital of Burkina Faso ?,LOC
What city is . KDGE Radio located in ?,LOC
What is the HIGHEST Roman numeral ?,DESC
What do the Japanese call Japan ?,ENTY
Why do we call someone `` honey '' ?,DESC
Who was the tallest U.S. president ?,HUM
What is the average time to kiss somene ?,NUM
In what part of Africa is Mozambique located ?,LOC
What do Japanese school uniforms look like ?,DESC
What was the name of the daughter of the Virginia chief Powhatan that married John Rolfe ?,HUM
What two countries are linked by the Brenner Pass ?,LOC
What Triple Crown-winning horse took the 1973 Belmont Stakes by 31 lengths ?,ENTY
What does Esa-Pekka Salonen look like ?,DESC
How many times has Harold Stassen announced a drive for the White House ?,NUM
What engineer invented the pull-tab can ?,HUM
What is widely used to detect prenatal birth defects ?,ENTY
"What country surrounds San Marino , the world 's smallest Republic ?",LOC
What was the Bridge of San Luis Rey made of ?,ENTY
When was the Big Thompson flood ?,NUM
Why does cotton get caught in belly buttons ?,DESC
What 's the largest U.S. agricultural crop by weight ?,ENTY
Whose cover is that of an employee of Universal Import and Export ?,HUM
What London street is the home of British journalism ?,LOC
How many rows of whiskers does a cat have ?,NUM
What 's the Hungarian word for pepper ?,ENTY
What information can you tell me about actor James Cromwell ?,HUM
How much will the California be in the year 2000 ?,NUM
What was the top box office movie in April 1998 ?,ENTY
How is Abigail Arcane related to the villainous opponent of the Swamp Thing ?,DESC
What is the former name of Zimbabwe ?,ENTY
What year was the setting for American Graffiti ?,NUM
Which way do you turn your Bic to increase the flame - clockwise or counterclockwise ?,LOC
What keeps clouds in the air ?,ENTY
What are the four largest mountain ranges in the continental United States ?,LOC
What is the one thing you need before you can purchase life insurance ?,ENTY
McCarren Airport is located in what city ?,LOC
"What does R.E.M. stand for , as in the rock group R.E.M. ?",ABBR
What is a person 's socioeconomic position ?,DESC
Who played Maria in the film West Side Story ?,HUM
When was the first practical commercial typewriter marketed ?,NUM
